gdmt:hasVerticalExtentDatum,has Vertical Extent Datum,owl:DatatypeProperty,has Vertical Extent Datum,The name of the Datum (reference frame) used for the Vertical Extent values.
gdmt:hasVerticalExtentDatumIRI,has Vertical Extent Datum IRI,owl:DatatypeProperty,has Vertical Extent Datum IRI,The unique identifier of the Datum (reference frame) used for the Vertical Extent values.
gdmt:hasTemporalExtentMinimumValue,has Temporal Extent Minimum Value,owl:DatatypeProperty,has Temporal Extent Minimum Value,The start date of the data.
gdmt:hasTemporalExtentMaximumValue,has Temporal Extent Maximum Value,owl:DatatypeProperty,has Temporal Extent Maximum Value,The end date of the data.
gdmt:hasTemporalResolution,has Temporal Resolution,owl:DatatypeProperty,has Temporal Resolution,Interval between two consecutive data records.
gdmt:hasDuration,has Duration,owl:DatatypeProperty,has Duration,The total duration of data temporal coverage.
gdmt:hasAwardTitle,has Award Title,owl:DatatypeProperty,has Award Title,"The human readable title of the award, grant, or other specific funding mechanism for the described dataset."
gdmt:hasAwardPageIRI,has Award Page IRI,owl:DatatypeProperty,has Award Page IRI,The IRI leading to a page provided by the funder for more information about the award (grant).
gdmt:hasAwardLocalIdentifier,has Award Local Identifier,owl:DatatypeProperty,has Award Local Identifier,"The code assigned by the funding provider to a sponsored award (grant). (Can be an IRI, but typically is not.)"
gdmt:hasFunderName,has Funder Name,owl:DatatypeProperty,has Funder Name,Name of the organization providing the funding for the described dataset ('funding provider').
gdmt:hasFunderIdentifier,has Funder Identifier,owl:DatatypeProperty,has Funder Identifier,Globally unique string that identifies the funding provider.
gdmt:hasFunderIdentifierScheme,has Funder Identifier Scheme,owl:DatatypeProperty,has Funder Identifier Scheme,Name of the schema for the funderIdentifier.
gdmt:hasFunderIdentifierSchemeIRI,has Funder Identifier Scheme IRI,owl:DatatypeProperty,has Funder Identifier Scheme IRI,IRI of the schema for the funder identifier.
gdmt:ResourceTypeCategory,Resource Type Category,,,This is a set of controlled terms from DataCite/DCMI for the category of resource being described.
gdmt:Audiovisual,Audiovisual,,,A series of visual representations imparting an impression of motion when shown in succession. May or may not include sound.,,gdmt:ResourceTypeCategory
gdmt:Collection,Collection,,,"An aggregation of resources, which may encompass collections of one resourceType as well as those of mixed types. A collection is described as a group; its parts may also be separately described.",,gdmt:ResourceTypeCategory
gdmt:DataPaper,Data Paper,,,"A factual and objective publication with a focused intent to identify and describe specific data, sets of data, or data collections to facilitate discoverability.",,gdmt:ResourceTypeCategory
gdmt:DataCatalog,Data Catalog,,,A collection of datasets.,,gdmt:ResourceTypeCategory
gdmt:Dataset,Dataset,,,Dataset is a logical grouping of one or more data streams. It is can be provided in various data distributions. Dataset might be part of (parent) data catalog.,,gdmt:ResourceTypeCategory
gdmt:DataStream,Data Stream,,,"Data stream represent a collection of one or more variable records originating from a single data source (e.g., sensor) which properties remain unchanged during the data stream existence. In some use-cases, the data source location is required to remain unchanged (e.g., sensors attached to a meteorological tower). Data stream can grow over time.",,gdmt:ResourceTypeCategory
gdmt:Event,Event,,,"A non-persistent, time-based occurrence.",,gdmt:ResourceTypeCategory
gdmt:Image,Image,,,A visual representation other than text,,gdmt:ResourceTypeCategory
gdmt:InteractiveResource,Interactive Resource,,,"A resource requiring interaction from the user to be understood, executed, or experienced",,gdmt:ResourceTypeCategory
gdmt:Model,Model,,,"An abstract, conceptual, graphical, mathematical or visualization model that represents empirical objects, phenomena, or physical processes.",,gdmt:ResourceTypeCategory
gdmt:PhysicalObject,Physical Object,,,"An inanimate, three-dimensional object or substance.",,gdmt:ResourceTypeCategory
gdmt:Service,Service,,,"An organized system of apparatus, appliances, staff, etc., for supplying some function(s) required by end users.",,gdmt:ResourceTypeCategory
gdmt:Software,Software,,,A computer program in source code (text) or compiled form. Use this type for all software components supporting scholarly research.,,gdmt:ResourceTypeCategory
gdmt:Sound,Sound,,,A resource primarily intended to be heard.,,gdmt:ResourceTypeCategory
